{
  "version": 1,
  "scope": {
    "label": "AI 활용 과학 연구 계획서 전용",
    "domains": ["소재·화학·분자", "단백질·생물·신약", "물리·PDE·기후", "신경과학", "의료영상"]
  },
  "required_sections": ["연구 목표", "방법", "데이터", "평가", "일정"],
  "templates": [
    {
      "id": "materials-gnn",
      "name": "재료·배터리 GNN 대리모델",
      "domain": "소재·화학·분자",
      "summary": "분자·결정 구조로 물성을 예측하는 그래프 신경망 대리모델",
      "file": "materials_gnn.md"
    },
    {
      "id": "protein-molecule",
      "name": "단백질·분자",
      "domain": "단백질·생물·신약",
      "summary": "단백질 서열·구조, 분자 결합·생성 모델",
      "file": "protein_molecule.md"
    },
    {
      "id": "physics-pde-climate",
      "name": "물리·PDE·기후",
      "domain": "물리·PDE·기후",
      "summary": "편미분방정식·기후 시뮬레이션 신경 대리모델",
      "file": "physics_pde_climate.md"
    },
    {
      "id": "neuro-fmri",
      "name": "신경과학 fMRI",
      "domain": "신경과학",
      "summary": "fMRI 신호 디코딩·분류와 뇌 연결성 분석",
      "file": "neuro_fmri.md"
    },
    {
      "id": "medical-imaging",
      "name": "의료영상",
      "domain": "의료영상",
      "summary": "X선·CT·MRI 영상 검출·분류·분할 모델",
      "file": "medical_imaging.md"
    }
  ],
  "examples": [
    {
      "id": "example-battery",
      "name": "전해액 이온전도도 GNN",
      "domain": "소재·화학·분자",
      "template_id": "materials-gnn",
      "path": "tests/fixtures/plans/plan.md"
    },
    {
      "id": "example-fmri",
      "name": "fMRI 인지과제 분류",
      "domain": "신경과학",
      "template_id": "neuro-fmri",
      "path": "tests/fixtures/plans/plan_elife_neuro.md"
    },
    {
      "id": "example-medimaging",
      "name": "흉부 X선 폐렴 검출",
      "domain": "의료영상",
      "template_id": "medical-imaging",
      "path": "tests/fixtures/plans/plan_medimaging.md"
    }
  ]
}
